place_id,name,description,is_spending_on_ads,reviews,website,owner_name,owner_profile_link,featured_image,main_category,categories,rating,workday_timing,closed_on,phone,address,review_keywords,link
ChIJpTfXJJaJ_RIRhuG0LF7HAuc,Hotel Iberostar SELECTION Diar El Andalous,"Hotel balneaire chic avec logements elegants, vue sur golfe pour certains, cuisine raffinee, spa, 2 piscines.",False,6813,https://www.iberostar.com/en/hotels/sousse/iberostar-diar-el-andalous/%3Futm_source%3Dgoogle%26utm_medium%3Dorganic%26utm_campaign%3DIBSVOL_EMEA_SEOLOC_GMB_NA_EN_TUN_TUN_SOU_DEA_PULL_NA_NA_NA_NA_NA,Hotel Iberostar SELECTION Diar El Andalous (proprietaire),https://www.google.com/maps/contrib/114312565251924916863,https://lh3.googleusercontent.com/gps-proxy/ALd4DhFlnfpswwu04yfsS5368mfWO4wPcsT7-aeXLOJArQyLNRyIGuc9KpJ1r3aeXy2UbCWLmRbBhBhLzUJxsfw4EtNhBR3wuieGjVwu5AifPpKiwsjcC1iKEIabHq44uykwD8fRDjCbWN7z3vFvuSKPycOK8ZfAu90N_RQI801PWp6due7FUXV_u_LS=w408-h272-k-no,Hotel,"Hotel, Complexe hotelier",4.8,,,73 246 200,"Hotel Iberostar SELECTION Diar El Andalous, 40 Port El Kantaoui BP, Sousse 4089","animation, equipe, divertissement, animateurs, josip broz tito, danser, spectacles, dedicace, zico, thangka",https://www.google.com/maps/place/Hotel+Iberostar+SELECTION+Diar+El+Andalous/data=!4m10!3m9!1s0x12fd899624d737a5:0xe702c75e2cb4e186!5m2!4m1!1i2!8m2!3d35.9027479!4d10.5887188!16s%2Fg%2F1tdtx_77!19sChIJpTfXJJaJ_RIRhuG0LF7HAuc?authuser=0&hl=fr&rclk=1
ChIJdc-EXIR1AhMRfunMH3KWB8o,JAZ Tour KHALEF,"Complexe raffine avec chambres et suites claires, spa, piscines d'eau salee et vue sur mer.",False,6106,https://www.jazhotels.com/hoteldetail/48-tunisia-tunisia-jaz-tour-khalef,JAZ Tour KHALEF (proprietaire),https://www.google.com/maps/contrib/117198368217060196270,https://lh5.googleusercontent.com/p/AF1QipODLb067KC1dTP_zHwcU8dc_vgjDdNUXh6IZSem=w408-h272-k-no,Hotel,"Hotel, Spa",4.7,,,73 241 844,"JAZ Tour KHALEF, Bd du 14 Janvier, Sousse 4051","animation, thalasso, animateurs, l'equipe, jazz, remerciement, disco, mahdi, fatiha",https://www.google.com/maps/place/JAZ+Tour+KHALEF/data=!4m10!3m9!1s0x130275845c84cf75:0xca0796721fcce97e!5m2!4m1!1i2!8m2!3d35.8488573!4d10.6198143!16s%2Fg%2F1hhxpwzxg!19sChIJdc-EXIR1AhMRfunMH3KWB8o?authuser=0&hl=fr&rclk=1
ChIJd7cxw6WJ_RIRwXZr4tiG3vg,Iberostar Selection Kantaoui Bay,,False,4214,https://www.iberostar.com/en/hotels/sousse/iberostar-kantaoui-bay/%3Futm_source%3Dgoogle%26utm_medium%3Dorganic%26utm_campaign%3DIBSVOL_EMEA_SEOLOC_GMB_NA_EN_TUN_TUN_SOU_KAN_PULL_NA_NA_NA_NA_NA,Iberostar Selection Kantaoui Bay (proprietaire),https://www.google.com/maps/contrib/108387175714831615540,https://lh5.googleusercontent.com/p/AF1QipOVU3xwYnExuTr2TeIcyx5t76cewpuaEgDiUhL2=w408-h272-k-no,Hotel,Hotel,4.8,,,73 246 477,"Iberostar Selection Kantaoui Bay, Jinene El Kantaoui, Hammam Sousse B.P. 243 Tunez, 4089","animation, divertir, animateurs, dido, thalasso, danse, simba, algues, vito, mario",https://www.google.com/maps/place/Iberostar+Selection+Kantaoui+Bay/data=!4m10!3m9!1s0x12fd89a5c331b777:0xf8de86d8e26b76c1!5m2!4m1!1i2!8m2!3d35.9121491!4d10.5801236!16s%2Fg%2F11g7_m11hs!19sChIJd7cxw6WJ_RIRwXZr4tiG3vg?authuser=0&hl=fr&rclk=1
ChIJ1ePlD6aJ_RIRQbRs53oXibk,Hotel Sentido Bellevue Park,Chambres raffinees dans elegant complexe balneaire tout compris avec piscines interieure et exterieure.,False,3126,https://www.sentido.com/en/Sentido-Bellevue-Park.html,Hotel Sentido Bellevue Park (proprietaire),https://www.google.com/maps/contrib/100559486130591275365,https://lh3.googleusercontent.com/gps-proxy/ALd4DhE0BFgZP2ozRBF1zb02PTQMQFI-HwflQ5eG7S7udxswQSIaAQOmkJoMjJeJmEfhLYoe5IzBFmE14hTVEYVOdJWtOJZQjG5KAzv0FVJ_C7rec5TbXGcsDlyHOGq3yXO2l9a_nz27t69FJ5-I8gHWC_Qr1zzQrI_347IcQlJbg4YNEHVVCJRdDx93bQ=w428-h240-k-no,Hotel,Hotel,4.6,,,73 246 300,"Hotel Sentido Bellevue Park, Port, Sousse 4089","animation, divertissement, spectacles, disco, animateurs, flechettes, DJ, tir a l'arc, zidane, MIMO",https://www.google.com/maps/place/H%C3%B4tel+Sentido+Bellevue+Park/data=!4m10!3m9!1s0x12fd89a60fe5e3d5:0xb989177ae76cb441!5m2!4m1!1i2!8m2!3d35.9136992!4d10.579784!16s%2Fg%2F1v9gxkfd!19sChIJ1ePlD6aJ_RIRQbRs53oXibk?authuser=0&hl=fr&rclk=1
ChIJB_dJLe2J_RIRdOAkXd2XmNY,Seabel Alhambra Beach Golf & Spa Port El Kantaoui,"Complexe haut de gamme comprenant 7 restaurants et bars, 6 piscines, 17 courts de tennis et spa avec hammam.",False,2335,https://www.seabelhotels.com/fr/seabel-alhambra-beach-golf-spa/acceuil/,Seabel Alhambra Beach Golf & Spa Port El Kantaoui (proprietaire),https://www.google.com/maps/contrib/116511676984917358070,https://lh5.googleusercontent.com/p/AF1QipOtqGJwHAIn5fBcfr-YzoeD6N3mBHzt_BgfsLxd=w408-h257-k-no,Complexe hotelier,"Complexe hotelier, Hotel",4.6,,,73 246 400,"Seabel Alhambra Beach Golf & Spa Port El Kantaoui, El Kantaoui, Sousse 4089","animation, animateurs, spectacles, serveurs, josip broz tito, emma, zen, present, sabotage, top, les",https://www.google.com/maps/place/Seabel+Alhambra+Beach+Golf+%26+Spa+Port+El+Kantaoui/data=!4m10!3m9!1s0x12fd89ed2d49f707:0xd69897dd5d24e074!5m2!4m1!1i2!8m2!3d35.9008624!4d10.5867007!16s%2Fg%2F1tfd9cfb!19sChIJB_dJLe2J_RIRdOAkXd2XmNY?authuser=0&hl=fr&rclk=1
ChIJGymJWQqK_RIRojgs5ucRyDY,Hotel Marhaba Royal Salem,"Logements clairs dans complexe convivial en bord de plage avec restaurant, piscines, club enfants et spa.",False,2205,https://www.royalsalem.tn/,Hotel Marhaba Royal Salem (proprietaire),https://www.google.com/maps/contrib/103136526160093510562,https://lh3.googleusercontent.com/gps-proxy/ALd4DhEqWbUcvfHIa1TE_ACiPeen0RWQ00150t5Jb9d6UBSU1H7L6PKd5xzzDhor27Zdby3V8x7Mh51xhqUusp1KLh8FFUIA6me99xnsXUWZQYI0hM83YOoy__iAkvNfWrY-M_Dj2lXn83Fh5EUElUjsxxZqA1qekYTXS412qow2OXzqiGsPpLPvlCuq=w408-h270-k-no,Hotel,Hotel,4.3,,,73 271 588,"Hotel Marhaba Royal Salem, Marhaba Royal Salem, Boulevard du 14 Janvier, Sousse 4039","animation, divertissement, pourboire, all inclusive, danse, toboggan, zumba, animateurs, flechettes, momos",https://www.google.com/maps/place/Hotel+Marhaba+Royal+Salem/data=!4m10!3m9!1s0x12fd8a0a5989291b:0x36c811e7e62c38a2!5m2!4m1!1i2!8m2!3d35.858572!4d10.6158463!16s%2Fg%2F1vpgzxgr!19sChIJGymJWQqK_RIRojgs5ucRyDY?authuser=0&hl=fr&rclk=1
ChIJy5NJ5Yh1AhMRVS9qKGeOiW0,Hotel Marhaba Beach,"Complexe simple en front de mer avec piscines interieure/exterieures, restaurant buffet et terrains de sport.",False,1667,http://marhababeach.tn/,Hotel Marhaba Beach (proprietaire),https://www.google.com/maps/contrib/101024654895170047676,https://lh5.googleusercontent.com/p/AF1QipOFsnm6okb4g8i56Z7ce5OFHtzLidHCRmbW_6Cf=w408-h306-k-no,Hotel,Hotel,4.2,,,73 240 112,"Hotel Marhaba Beach, Bd du 14 Janvier, Sousse 4039","animation, all inclusive, divertir, jour ferie, pourboires, territoire, massage, hammam, animateurs, maitre nageur",https://www.google.com/maps/place/H%C3%B4tel+Marhaba+Beach/data=!4m10!3m9!1s0x13027588e54993cb:0x6d898e67286a2f55!5m2!4m1!1i2!8m2!3d35.8487989!4d10.6197962!16s%2Fg%2F1tg_090c!19sChIJy5NJ5Yh1AhMRVS9qKGeOiW0?authuser=0&hl=fr&rclk=1
ChIJGymJWQqK_RIR6UVXmST4jQ4,Hotel Marhaba Salem,"Hotel en bord de plage avec piscines en interieur et en exterieur, spa, 4 restaurants et 3 bars.",False,1662,http://www.marhabasalem.tn/,Hotel Marhaba Salem (proprietaire),https://www.google.com/maps/contrib/108481785392645967866,https://lh5.googleusercontent.com/p/AF1QipONhIid2uUzfPnS7E37JGJUhB-hdxHF2rqElTvA=w426-h240-k-no,Hotel,Hotel,4.4,,,73 240 966,"Hotel Marhaba Salem, Boulevard 14 Janvier 4039 Sousse, Hammam Sousse 4039","animation, divertir, danse, animateurs, zumba, momos, disco, flechettes, tir a l'arc, aquagym",https://www.google.com/maps/place/Hotel+Marhaba+Salem/data=!4m10!3m9!1s0x12fd8a0a5989291b:0xe8df824995745e9!5m2!4m1!1i2!8m2!3d35.8594365!4d10.6164423!16s%2Fg%2F1vp5_3hj!19sChIJGymJWQqK_RIR6UVXmST4jQ4?authuser=0&hl=fr&rclk=1
ChIJ7b21j5OJ_RIRYZV1-LCC8yA,Hotel Marhaba Palace,"Hotel raffine avec acces a la plage, salle de sport, 4 bars, une discotheque et un petit-dejeuner gratuit.",False,1588,http://marhabapalace.tn/,Hotel Marhaba Palace (proprietaire),https://www.google.com/maps/contrib/107095216000784294387,https://lh5.googleusercontent.com/p/AF1QipOvko8sKKUTYL5OoEYpa_DIA-Ts21E3I9ud3397=w408-h255-k-no,Hotel,"Hotel, Salle de gym, Spa",4.2,,,73 347 076,"Hotel Marhaba Palace, Port, 4089","plage, animation, pourboires, spa, divertissements, serveurs, all inclusive, port, hammam, chameau",https://www.google.com/maps/place/H%C3%B4tel+Marhaba+Palace/data=!4m10!3m9!1s0x12fd89938fb5bded:0x20f382b0f8759561!5m2!4m1!1i2!8m2!3d35.8965006!4d10.5935854!16s%2Fg%2F1ttthym6!19sChIJ7b21j5OJ_RIRYZV1-LCC8yA?authuser=0&hl=fr&rclk=1
ChIJ_XqzlaaJ_RIRfyPsuno_VGo,Royal Kenz Hotel Thalasso & Spa,"Chambres et suites conviviales dans complexe haut de gamme avec 3 piscines (1 interieure), spa et mini-golf.",False,1586,http://www.hotelroyalkenz.com/,Royal Kenz Hotel Thalasso & Spa (proprietaire),,https://lh3.googleusercontent.com/gps-proxy/ALd4DhEXbGPcIXDmZNNqmc17Z-9E6kLYBo-LJoI4OVoH0k1pXhfcaThimnEFtJOulxQwDPpOauRgNyiBDc8tiwtA1OLdr6gA9cBDjYDPmF_CFVuwh3vIJ82kHzS9MMqgiSVvStumYsnBPyATptsWHcCnJ-oUfFCSQWbdQk76MC4Eb8BSNpt4wxeW-Y2k=w408-h276-k-no,Hotel,Hotel,4.2,,,73 246 100,"WH6H+6JX Royal Kenz Hotel Thalasso & Spa, Hammam Sousse","divertissement, animation, jour ferie, all inclusive, thalassotherapie, fourmis, massages, serveurs, bemol, animateurs",https://www.google.com/maps/place/Royal+Kenz+Hotel+Thalasso+%26+Spa/data=!4m10!3m9!1s0x12fd89a695b37afd:0x6a543f7abaec237f!5m2!4m1!1i2!8m2!3d35.9106026!4d10.5791006!16s%2Fg%2F1tk1w8bg!19sChIJ_XqzlaaJ_RIRfyPsuno_VGo?authuser=0&hl=fr&rclk=1
ChIJvypHhYh1AhMRLl_Lk51M3hE,Occidental Sousse Marhaba,"Chambres et suites classiques dans hotel raffine avec 3 restaurants, 8 bars, discotheque et piscines.",False,1442,https://www.barcelo.com/fr-fr/occidental-sousse-marhaba/%3Futm_source%3Dgoogle%26utm_medium%3Dorganic%26utm_campaign%3Dmy_business%26utm_content%3D10319,Occidental Sousse Marhaba (proprietaire),https://www.google.com/maps/contrib/100629833311419019805,https://lh3.googleusercontent.com/gps-proxy/ALd4DhHdX1pBD3ceWbznAVpCh5RGc2W-X_L7i5a267-8JNIo7EMADTggGioBSzdTdMNg43Gt2HizOaTNrhsYwnf090DGslZ1WI_7jRofc6oKClyB2auXo-31FiRpnRaBK-e2JAhwaqBD4AAJxSdqzSlZF_L0Dsdd7xaGCnXJwYBoH2GAa9tdLD0TfJinEQ=w408-h254-k-no,Hotel,"Hotel, Piscine",4,,,73 241 667,"Occidental Sousse Marhaba, 2011 Av. 14 Janvier, Sousse 4039","plage, all inclusive, animation, divertissement, serveurs, toboggan, buffet, animateurs, aquagym, flechettes",https://www.google.com/maps/place/Occidental+Sousse+Marhaba/data=!4m10!3m9!1s0x1302758885472abf:0x11de4c9d93cb5f2e!5m2!4m1!1i2!8m2!3d35.846735!4d10.6219208!16s%2Fg%2F1tf8b331!19sChIJvypHhYh1AhMRLl_Lk51M3hE?authuser=0&hl=fr&rclk=1
ChIJPWcwaJSJ_RIRZfkokxE61aU,Concorde Green Park Palace,"Hotel haut de gamme en bord de mer comprenant chambres et suites chics, restaurants, bars et piscine.",False,1388,https://www.barcelo.com/en-ww/barcelo-concorde-green-park-palace/%3Futm_source%3Dgoogle%26utm_medium%3Dorganic%26utm_campaign%3Dmy_business%26utm_content%3D30844,Concorde Green Park Palace (proprietaire),https://www.google.com/maps/contrib/102656688508524950060,https://lh5.googleusercontent.com/p/AF1QipPt1MqFvP2p1HZkmhDDIr0WRUqKx6suQuIUD_0V=w408-h272-k-no,Hotel,Hotel,4.2,,,36 030 000,"Concorde Green Park Palace, Rue Morjan B.P. Box. 95 Port, Hammam Sousse 4089","mer, animation, pourboire, all inclusive, serveurs, terrain de golf, port, transat, animateurs, meduses",https://www.google.com/maps/place/Concorde+Green+Park+Palace/data=!4m10!3m9!1s0x12fd89946830673d:0xa5d53a119328f965!5m2!4m1!1i2!8m2!3d35.8976729!4d10.5924397!16s%2Fg%2F1trl7zpn!19sChIJPWcwaJSJ_RIRZfkokxE61aU?authuser=0&hl=fr&rclk=1
ChIJi7lMMnWK_RIRlRJwFPpdV1E,TUI BLUE Sheherazade,"Complexe raffine reserve aux adultes avec plage privee, cinema en plein air et plusieurs restaurants.",False,778,https://www.magichotelsandresorts.com/scheherazade,TUI BLUE Sheherazade (proprietaire),https://www.google.com/maps/contrib/108860612505043844170,https://lh3.googleusercontent.com/gps-proxy/ALd4DhGsZYNiEZLrVM7RtRgb6rMCpoGGrCPvq3-a03MQRuYkLRAwjcICeNJj32J_GIkMTuSYU_FBPzHEUu4Zk1aE-8LK8eUSnVytuUPLO2jdO9YigQc6_6Mwhj9tc_gxz4355Dr_54CqYjaB5mfT-0i0D7VxfChvfw9rOn5y34WpPUUrDUBJ6zfZM02Trg=w408-h272-k-no,Hotel,Hotel,4.6,,,72 271 222,"TUI BLUE Sheherazade, Boulevard du 14 Janvier, Sousse 4039","adultes, employes, animation, all inclusive, divertissement, a la carte, vue sur la mer, calme, plage privee, dentelle",https://www.google.com/maps/place/TUI+BLUE+Sheherazade/data=!4m10!3m9!1s0x12fd8a75324cb98b:0x51575dfa14701295!5m2!4m1!1i2!8m2!3d35.8569808!4d10.6175063!16s%2Fg%2F11g8b4_dwj!19sChIJi7lMMnWK_RIRlRJwFPpdV1E?authuser=0&hl=fr&rclk=1
ChIJaf9FkB6K_RIRDlg6A7ptuFc,Hasdrubal Thalassa & Spa Port El Kantaoui Hotel,"Chambres et suites contemporaines avec balcon dans un hotel chic en bord de mer, spa et 2 piscines.",False,265,http://kantaoui.hasdrubal-thalassa.com/,Hasdrubal Thalassa & Spa Port El Kantaoui Hotel (proprietaire),https://www.google.com/maps/contrib/102558356588847544341,https://lh5.googleusercontent.com/p/AF1QipMebVJtZfuT4qGA5iCnNr4jVoh_jEt5mDJmmC7y=w408-h272-k-no,Hotel,Hotel,4.4,,,73 348 944,"Hasdrubal Thalassa & Spa Port El Kantaoui Hotel, Hasdrubal Thalassa & Spa, Zone Touristique Port El Kantaoui, Port El Kantaoui 4089","piscine, plage, thalasso, chambre, gentillesse, calme, jardin, confortable, sourire, golf",https://www.google.com/maps/place/Hasdrubal+Thalassa+%26+Spa+Port+El+Kantaoui+Hotel/data=!4m10!3m9!1s0x12fd8a1e9045ff69:0x57b86dba033a580e!5m2!4m1!1i2!8m2!3d35.8899447!4d10.5984385!16s%2Fg%2F1tdktx90!19sChIJaf9FkB6K_RIRDlg6A7ptuFc?authuser=0&hl=fr&rclk=1
ChIJr1Sx_oN1AhMRAPJuAKR1b0s,Hotel Soussana,,False,78,,Hotel Soussana (proprietaire),https://www.google.com/maps/contrib/113095357302890464724,https://lh5.googleusercontent.com/p/AF1QipMGSoR3rG0LTGMk5XH72QFBxkfBzLjAc99T0x_Y=w408-h272-k-no,Hotel,Hotel,4,,,73 228 011,"Hotel Soussana, Avenue Taieb Mhiri, Sousse","prix, chambre, plage, parking, service",https://www.google.com/maps/place/H%C3%B4tel+Soussana/data=!4m10!3m9!1s0x13027583feb154af:0x4b6f75a4006ef200!5m2!4m1!1i2!8m2!3d35.8398389!4d10.6245155!16s%2Fg%2F11cn9kx5cn!19sChIJr1Sx_oN1AhMRAPJuAKR1b0s?authuser=0&hl=fr&rclk=1
ChIJu8QbACyL_RIRpQuygMOV4OU,Dar Hkaiem,,False,58,,Dar Hkaiem (proprietaire),https://www.google.com/maps/contrib/101399924937971354548,https://lh3.googleusercontent.com/gps-proxy/ALd4DhHEUSAl-d_u2pbQG5M-X3BxyR1t64vwOaEYpw_PPOXKTk7KOiTTfE_cqp1xfne9GQOrtZ4lB2knAe9A_4EER2BKoEeVu4Zeh_arIr_mz3CsC-iCQk_090Y4ojdwICQbeyWkCpwPRbpBP6GazkZxHRl4nMt7n99gsmoz8ZH9wY7LHO2oZ-kprQQuaQ=w408-h544-k-no,Chambre d'hotes,Chambre d'hotes,4.7,,,99 957 111,"Dar Hkaiem, Rue du Sahloul,, Hammam Sousse","petit hotel, matin, voyage, experience, nettoyage, culture, internet",https://www.google.com/maps/place/Dar+Hka%C3%AFem/data=!4m10!3m9!1s0x12fd8b2c001bc4bb:0xe5e095c380b20ba5!5m2!4m1!1i2!8m2!3d35.8569077!4d10.5892135!16s%2Fg%2F11j8k7_0v3!19sChIJu8QbACyL_RIRpQuygMOV4OU?authuser=0&hl=fr&rclk=1
ChIJ6UIxrBuK_RIRV8Lvk3ei_yo,Residence Le Jasmin,,False,26,,Residence Le Jasmin (proprietaire),https://www.google.com/maps/contrib/104796919509526659981,https://lh3.googleusercontent.com/gps-proxy/ALd4DhF5bD1z9Fs6cVPSvtGJP65yat_0d_sWkxRnFciYLysWfflDxDivgR3pks9-XiOBphViu9xmgsWUnoBjw1JVnJ9evySpGw0VPPsPl1npHEGG1ygP9aXTdYAKmlKgXR_Vn5RFUJ9-6cgniP-QLmqkNQSjJXmWyY7Pw_7CLNHl5O6J6ZKCpNfQxg=w408-h306-k-no,Hotel,Hotel,4.1,,,54 481 980,"Residence Le Jasmin, Route Touristique, Avenue 14 Janvier, Oued El Hammam, Sousse",,https://www.google.com/maps/place/R%C3%A9sidence+Le+Jasmin/data=!4m10!3m9!1s0x12fd8a1bac3142e9:0x2affa27793efc257!5m2!4m1!1i2!8m2!3d35.8713588!4d10.604291!16s%2Fg%2F11b73mkj7x!19sChIJ6UIxrBuK_RIRV8Lvk3ei_yo?authuser=0&hl=fr&rclk=1
ChIJeYQUKReK_RIR9kL3n8lEnPg,Villa Hamandi,,False,13,,Villa Hamandi (proprietaire),https://www.google.com/maps/contrib/109011303577873566728,https://lh5.googleusercontent.com/p/AF1QipOSawIr4lA8aMu72ARhmGy-BkOBOCDKdGxyGCeo=w426-h240-k-no,Residence hoteliere,Residence hoteliere,4.6,,,+33 6 03 23 18 23,"Villa Hamandi, 26, RUE ABDEL MOUMEN IBN ALI, Hammam Sousse 4011",,https://www.google.com/maps/place/Villa+Hamandi/data=!4m10!3m9!1s0x12fd8a1729148479:0xf89c44c99ff742f6!5m2!4m1!1i2!8m2!3d35.8668315!4d10.6019535!16s%2Fg%2F11f4_3k3sr!19sChIJeYQUKReK_RIR9kL3n8lEnPg?authuser=0&hl=fr&rclk=1
ChIJ42h3kEqL_RIRd9BF4hmDkhk,Residence House VIP,,False,9,,Residence House VIP (proprietaire),,https://streetviewpixels-pa.googleapis.com/v1/thumbnail?panoid=veYNM8S3czw3kFTejYdNhw&cb_client=search.gws-prod.gps&w=408&h=240&yaw=333.7896&pitch=0&thumbfov=100,Hotel,Hotel,4.9,,,,"Residence House VIP, 85 Rte de la Plage, Hammam Sousse",,https://www.google.com/maps/place/R%C3%A9sidence+House+VIP/data=!4m10!3m9!1s0x12fd8b4a907768e3:0x19928319e245d077!5m2!4m1!1i2!8m2!3d35.864385!4d10.6066368!16s%2Fg%2F11h4xhf8z6!19sChIJ42h3kEqL_RIRd9BF4hmDkhk?authuser=0&hl=fr&rclk=1
ChIJdTTWYnV1AhMR6bJKK_Xlqh4,Jawhara Coralia Club,,False,6,,Jawhara Coralia Club (proprietaire),,https://lh3.googleusercontent.com/gps-proxy/ALd4DhHzWM45-dJ_lOfU_e8jMMLxBzWApvD58qluxMvADmB3RSolSCDfRD_VAPBMddKFNLu2u_l4Mt0Vz1gCltxXp0ABPf6OTv7I4Tmw8zTNsKD-Al2ws4zLFm2k88ZTvq7YIU-TqFX2LZjGSmelLujbXoSe-roNHzptc6Ataw37lMvEn-0VXX63P2SCog=w408-h332-k-no,Hotel bien-etre,Hotel bien-etre,4,,,,"VJ66+CXP Jawhara Coralia Club, Sousse",,https://www.google.com/maps/place/Jawhara+Coralia+Club/data=!4m10!3m9!1s0x1302757562d63475:0x1eaae5f52b4ab2e9!5m2!4m1!1i2!8m2!3d35.8610751!4d10.6124657!16s%2Fg%2F1tf552p3!19sChIJdTTWYnV1AhMR6bJKK_Xlqh4?authuser=0&hl=fr&rclk=1
ChIJzY_a_BaK_RIRutZ-Wrh6lkI,Residence alizo,,False,4,,Residence alizo (proprietaire),,,Hotel,Hotel,4,,,,"VJ82+J69 Residence alizo, Sousse",,https://www.google.com/maps/place/R%C3%A9sidence+alizo/data=!4m10!3m9!1s0x12fd8a16fcda8fcd:0x42967ab85a7ed6ba!5m2!4m1!1i2!8m2!3d35.8665262!4d10.600607!16s%2Fg%2F11c1nzbyzf!19sChIJzY_a_BaK_RIRutZ-Wrh6lkI?authuser=0&hl=fr&rclk=1
ChIJ50PjqQuL_RIR1VZlrETRRz0,Sunset Beach Apartment,,False,4,,Sunset Beach Apartment (proprietaire),,https://lh3.googleusercontent.com/gps-proxy/ALd4DhGA7dZFfyDZ5UpDDlQgeFTymrVFJ4_EM06UQfR8E7CoCWNl2Z4cfIcoanPHlcyuTjs_Ha-vR4MqrFvKq_iIFMOv0YqUoOp8UP0g5gFLw9IOL740eAWYgrh2OxtbP5cxnOTdmagS9h7RFJVl6mZH2LvAtRFXQnxP9W-oRdF1LfJk-RiHtjnbm0J_=w408-h306-k-no,Hotel,Hotel,4,,,,"Sunset Beach Apartment, Zone Touristique, 4011, Rte de la Plage, Hammam Sousse",,https://www.google.com/maps/place/Sunset+Beach+Apartment/data=!4m10!3m9!1s0x12fd8b0ba9e343e7:0x3d47d144ac6556d5!5m2!4m1!1i2!8m2!3d35.8663732!4d10.609355!16s%2Fg%2F11fd6k9qzm!19sChIJ50PjqQuL_RIR1VZlrETRRz0?authuser=0&hl=fr&rclk=1
ChIJDWgS9MiJ_RIRWU-iudMBahg,Hannibal palace,,False,3,,Hannibal palace (proprietaire),,https://lh5.googleusercontent.com/p/AF1QipNlaWmiHHsPyn4-D8HlQb5z8KiQ4HNtJQfRjVvD=w408-h725-k-no,Hotel,Hotel,4.3,,,,"VHXJ+73H Hannibal palace, Hammam Sousse",,https://www.google.com/maps/place/Hannibal+palace/data=!4m10!3m9!1s0x12fd89c8f412680d:0x186a01d3b9a24f59!5m2!4m1!1i2!8m2!3d35.8981817!4d10.5802295!16s%2Fg%2F11l24h5csr!19sChIJDWgS9MiJ_RIRWU-iudMBahg?authuser=0&hl=fr&rclk=1
