place_id,name,description,is_spending_on_ads,reviews,website,owner_name,owner_profile_link,featured_image,main_category,categories,rating,workday_timing,closed_on,phone,address,review_keywords,link
ChIJjyy-cUuk-xIRZJdVHcYgYPA,Dar Alyssa,,False,56,,Dar Alyssa (proprietaire),,https://lh5.googleusercontent.com/p/AF1QipMuKHYS0nNK-5difi5hMXOa3KYVKDW-44Lugyfe=w408-h306-k-no,Restaurant,Restaurant,4.4,,,97 926 051,"5PH4+XF9 Dar Alyssa, El Kef","petit dejeuner, chambres, famille",https://www.google.com/maps/place/Dar+Alyssa/data=!4m10!3m9!1s0x12fba44b71be2c8f:0xf06020c61d559764!5m2!4m1!1i2!8m2!3d36.1799104!4d8.7062362!16s%2Fg%2F11c0tb3bss!19sChIJjyy-cUuk-xIRZJdVHcYgYPA?authuser=0&hl=fr&rclk=1
ChIJzUIG-Eik-xIRAO8kqPJDAAw,"Maison d'Hotes Dar Boumakhlouf, style d architecture mauresque, 3chambres decorees d artisanat locale, table d hotes dans la pure tradition culinaire keffoise et Tunisienne",,False,51,,"Maison d'Hotes Dar Boumakhlouf, style d architecture mauresque, 3chambres decorees d artisanat locale, table d hotes dans la pure tradition culinaire keffoise et Tunisienne (proprietaire)",https://www.google.com/maps/contrib/104541665406280363369,https://lh5.googleusercontent.com/p/AF1QipMleaHXHGTQxSkQL2MLXUwHyZvM7grmsAO22jmC=w408-h305-k-no,Maison d'hotes,"Maison d'hotes, Hotel",4.6,,,20 447 116,"Maison d'Hotes Dar Boumakhlouf, style d architecture mauresque, 3chambres decorees d artisanat locale, table d hotes dans la pure tradition culinaire keffoise et Tunisienne, Becha, 13 Rue Kheireddine, Le Kef 7100",,"https://www.google.com/maps/place/Maison+d%27H%C3%B4tes+Dar+Boumakhlouf,+style+d+architecture+mauresque,+3chambres+d%C3%A9cor%C3%A9es+d+artisanat+locale,+table+d+h%C3%B4tes+dans+la+pure+tradition+culinaire+keffoise+et+Tunisienne/data=!4m10!3m9!1s0x12fba448f80642cd:0xc0043f2a824ef00!5m2!4m1!1i2!8m2!3d36.1811015!4d8.7130363!16s%2Fg%2F119wstd5s!19sChIJzUIG-Eik-xIRAO8kqPJDAAw?authuser=0&hl=fr&rclk=1"
ChIJP9me8_Wl-xIR0dF5Y-yY0rc,"Maison d'hote Casa Zitouna Kef, TN",,False,22,http://www.facebook.com/CasaZitounaKef,"Maison d'hote Casa Zitouna Kef, TN (proprietaire)",https://www.google.com/maps/contrib/113724508951193675356,https://lh5.googleusercontent.com/p/AF1QipM8R3qqT652aGwDeZeGRiLdHIWyiy1B0g4ZVpNn=w408-h271-k-no,Chambre d'hotes,Chambre d'hotes,4.3,,,54 461 577,"Maison d'hote Casa Zitouna Kef, TN, Cite Zitouna",,"https://www.google.com/maps/place/Maison+d%27h%C3%B4te+Casa+Zitouna+Kef,+TN/data=!4m10!3m9!1s0x12fba5f5f39ed93f:0xb7d298ec6379d1d1!5m2!4m1!1i2!8m2!3d36.1825655!4d8.7055864!16s%2Fg%2F11fst80kdx!19sChIJP9me8_Wl-xIR0dF5Y-yY0rc?authuser=0&hl=fr&rclk=1"
ChIJ08P6wCKl-xIR6EpiVq_h0Lg,Residence Venus,,False,12,,Residence Venus (proprietaire),,https://lh5.googleusercontent.com/p/AF1QipMhMVUsY6CVxqz-w94U9FELQ9Q2vwpda583a9Fr=w408-h306-k-no,Hotel,Hotel,4.4,,,78 204 695,"5PJ5+VWH Residence Venus, Rue de la source, El Kef",prix,https://www.google.com/maps/place/R%C3%A9sidence+V%C3%A9nus/data=!4m10!3m9!1s0x12fba522c0fac3d3:0xb8d0e1af56624ae8!5m2!4m1!1i2!8m2!3d36.1821974!4d8.7098633!16s%2Fg%2F11h2j6mhb2!19sChIJ08P6wCKl-xIR6EpiVq_h0Lg?authuser=0&hl=fr&rclk=1
ChIJqfaBzcGl-xIRg5OeqSzzYTw,Residence Eddyr,,False,5,https://m.facebook.com/100045277251772/,Residence Eddyr (proprietaire),,https://lh3.googleusercontent.com/gps-proxy/ALd4DhFDVtga3FSz_jGgWxM3O426u_WmCmmdo6moHiadskCE3UrE5Id90OWr7N61sPrtmcY1YQeQ-H4Nsq3dUOCbPi_uScIuepgU2b8Yi277r-u4ZAHpmrKAeAgyyx2FtkH_60zUGNKBC9HmTsVDtB70x2ZDU8vnGXhSYks2gPNNeoJa9csSfKqeTP2Wmw=w408-h277-k-no,Chambre d'hotes,Chambre d'hotes,4,,,99 884 114,"5PGJ+HGV Residence Eddyr, Unnamed Road, Le Kef",,https://www.google.com/maps/place/R%C3%A9sidence+Eddyr/data=!4m10!3m9!1s0x12fba5c1cd81f6a9:0x3c61f32ca99e9383!5m2!4m1!1i2!8m2!3d36.176482!4d8.7312974!16s%2Fg%2F11fj_b227h!19sChIJqfaBzcGl-xIRg5OeqSzzYTw?authuser=0&hl=fr&rclk=1
