place_id,name,description,is_spending_on_ads,reviews,website,owner_name,owner_profile_link,featured_image,main_category,categories,rating,workday_timing,closed_on,phone,address,review_keywords,link
ChIJ45cjaD_F_RIRHrojZwgOIYk,Mosquee Okba Ibn Nafaa,"Celebre mosquee datant du VIIe siecle avec murs imposants, minaret carre et ornements architecturaux.",False,2209,,Mosquee Okba Ibn Nafaa (proprietaire),,https://lh5.googleusercontent.com/p/AF1QipNEL5TfujiOvcePKvWqK5nPcjo2E41qK7BFskET=w408-h306-k-no,Mosquee,"Mosquee, Lieu historique, Attraction touristique",4.6,08:00-14:00,,76 489 133,"M4J3+GMV Mosquee Okba Ibn Nafaa, Rue De La Kasbah, Kairouan","histoire, monument, colonnes, minaret, oqba ibn nafi al-fihri, civilisation islamique, marbre, edifice, cadran solaire, djellaba",https://www.google.com/maps/place/Mosqu%C3%A9e+Okba+Ibn+Nafaa/data=!4m7!3m6!1s0x12fdc53f682397e3:0x89210e086723ba1e!8m2!3d35.6813693!4d10.1041651!16zL20vMGYyNmZz!19sChIJ45cjaD_F_RIRHrojZwgOIYk?authuser=0&hl=fr&rclk=1
ChIJOWjha2rF_RIRRqLXG1-5anQ,Bassins des Aghlabides,,False,480,,Bassins des Aghlabides (proprietaire),,https://lh5.googleusercontent.com/p/AF1QipPy_tb4qyhSmZKvreOpGr_lR2_9u2nYB_ETcyhT=w408-h306-k-no,Lieu historique,"Lieu historique, Site historique, Attraction touristique",4.1,Ouvert 24h/24,,,"M3PW+R5V Bassins des Aghlabides, Av. de la Republique, Kairouan","tourisme, ixe siecle, monument historique, civilisation islamique, lac de barrage, aqueduc, pluie, ouvrage hydraulique, parcs, alimentation en eau potable",https://www.google.com/maps/place/Bassins+des+Aghlabides/data=!4m7!3m6!1s0x12fdc56a6be16839:0x746ab95f1bd7a246!8m2!3d35.6871107!4d10.0954229!16s%2Fg%2F121zpg5t!19sChIJOWjha2rF_RIRRqLXG1-5anQ?authuser=0&hl=fr&rclk=1
ChIJxVV9l1zF_RIRlG-WtJiLFCs,Mosquee du Barbier jm` by zm`@ lblwy,,False,315,,Mosquee du Barbier jm` by zm`@ lblwy (proprietaire),https://www.google.com/maps/contrib/110502506598131397397,https://lh5.googleusercontent.com/p/AF1QipPOFhSqYE7WLJwhqDqVjtRY5ZFTtV1Ro_c9XtN7=w426-h240-k-no,Monastere,"Monastere, Attraction touristique",4.6,07:00-20:00,,77 288 258,"Mosquee du Barbier jm` by zm`@ lblwy, Mosquee du Barbier, Av. de la Republique, Kairouan 3100",,https://www.google.com/maps/place/Mosqu%C3%A9e+du+Barbier+%D8%AC%D8%A7%D9%85%D8%B9+%D8%A7%D8%A8%D9%8A+%D8%B2%D9%85%D8%B9%D8%A9+%D8%A7%D9%84%D8%A8%D9%84%D9%88%D9%8A%E2%80%AD/data=!4m7!3m6!1s0x12fdc55c977d55c5:0x2b148b98b4966f94!8m2!3d35.6821!4d10.0899!16s%2Fg%2F121lmgkq!19sChIJxVV9l1zF_RIRlG-WtJiLFCs?authuser=0&hl=fr&rclk=1
ChIJJVGCiEfF_RIRsaU-TnuijLw,Mosquee des trois portes,,False,54,,Mosquee des trois portes (proprietaire),,https://lh5.googleusercontent.com/p/AF1QipP2oxuYeAlDYd14akbPemo-ybM9j-MpAwzoXIS_=w408-h544-k-no,Mosquee,"Mosquee, Attraction touristique",4.4,,,,"M4G3+W3W Mosquee des trois portes, Avineda De Kortoba, Kairouan",,https://www.google.com/maps/place/Mosqu%C3%A9e+des+trois+portes/data=!4m7!3m6!1s0x12fdc54788825125:0xbc8ca27b4e3ea5b1!8m2!3d35.6773608!4d10.1027013!16s%2Fg%2F120p4gml!19sChIJJVGCiEfF_RIRsaU-TnuijLw?authuser=0&hl=fr&rclk=1
ChIJPcyz4xbF_RIRlrjWYXkdgJk,Mausolee Sidi Amor Abada,,False,11,,Mausolee Sidi Amor Abada (proprietaire),,https://lh5.googleusercontent.com/p/AF1QipN-nowKs82lEj_zLqbocOHApyASu9kyvTU9v8aY=w408-h541-k-no,Musee,Musee,3.8,,,,"M3GV+QX9 Mausolee Sidi Amor Abada, Rue Sidi Gaid, Kairouan",,https://www.google.com/maps/place/Mausole%C3%A9+Sidi+Amor+Abada/data=!4m7!3m6!1s0x12fdc516e3b3cc3d:0x99801d7961d6b896!8m2!3d35.6769869!4d10.0950488!16s%2Fg%2F122cnhq7!19sChIJPcyz4xbF_RIRlrjWYXkdgJk?authuser=0&hl=fr&rclk=1
